{"analyzer":{"checkpoint_validator_sha256":"1b814da3ef9e1f20804b934b91f6621ed65159dd9dfab5bfbfdd2df95f82d20b","name":"work-engine-deterministic-baseline","source_sha256":"47e486ce1539bbfe1ab466d77650d9bb3e0338222478ae445fe6a07ba95e2003","version":"2"},"coverage":{"manifest_paths":1,"path_scope":"attributed checkpoint manifest","profiled_paths":1},"limitations":["Renames are intentionally disabled in the deterministic baseline.","Changed-symbol analysis is bounded to top-level Python definitions."],"observations":{"changed_symbols":{"state":"observed","value":[{"measurement":{"state":"observed","value":[{"change":"added","name":"added"},{"change":"modified","name":"old"}]},"path":"sample.py"}]},"configuration_file_count":{"state":"observed","value":0},"documentation_file_count":{"state":"observed","value":0},"file_categories":{"state":"observed","value":{"source":1}},"file_count":{"state":"observed","value":true},"files":{"state":"observed","value":[{"additions":4,"binary":false,"category":"source","deletions":1,"path":"sample.py"}]},"hunk_count":{"state":"observed","value":1},"line_totals":{"state":"observed","value":{"additions":4,"deletions":1}},"module_distribution":{"state":"observed","value":{".":1}},"test_file_count":{"state":"observed","value":0}},"profile_digest":"a0c865ecfbac72cdec3247833699417dd5cd7363280078a404c1444fff3aa581","provenance":{"derivation_sources":{"checkpoint_subject":{"identity":{"subject_digest":"5f189816aedcc2dc65b2953518241f6a054e25612fe3905340352ebf7e8efd23"},"use_state":"used"},"checkpoint_validator":{"identity":{"sha256":"1b814da3ef9e1f20804b934b91f6621ed65159dd9dfab5bfbfdd2df95f82d20b"},"use_state":"used"},"classifier":{"reason":"deferred_by_profile_scope","use_state":"not_used"},"git_runtime":{"identity":{"executable_sha256":"5516c9f362c29376ab9a499a33082f9f611941d8c75930c880e30ad109e39c9a","version":"git version 2.53.0"},"use_state":"used"},"invariant_catalog":{"reason":"deferred_by_profile_scope","use_state":"not_used"},"python_runtime":{"identity":{"executable_sha256":"52e0a13e60a981d8c4b6478be2ba5176f69da07948a056bf49cf6f077e30cb41","implementation":"CPython","version":"3.14.4"},"use_state":"used"},"repository_trees":{"identity":{"baseline_tree_oid":"17868afbf46ea53715981fce83171001c632b957","result_tree_oid":"7393c5731d895328d17ce478214454f64c28ff40","task_patch_digest":"b61af5824c4121108216aeb4f9daa359b5b313f754836057a321415fc239e7d0"},"use_state":"used"},"structural_graph":{"reason":"deferred_by_profile_scope","use_state":"not_used"}},"producer":{"checkpoint_validator_sha256":"1b814da3ef9e1f20804b934b91f6621ed65159dd9dfab5bfbfdd2df95f82d20b","name":"work-engine-deterministic-baseline","source_sha256":"47e486ce1539bbfe1ab466d77650d9bb3e0338222478ae445fe6a07ba95e2003","version":"2"}},"schema_version":2,"subject":{"checkpoint":{"baseline_commit_oid":"a8e074d765d94a7e816b7ab49db428fd4a760a9f","baseline_tree_oid":"17868afbf46ea53715981fce83171001c632b957","candidate_attempt":1,"checkpoint_commit_oid":"0ea3a9b7d55f5d6c719df018fab82105536aa82d","checkpoint_id":"3cce7b0e413849a7a1c69910c1be34401f34f7f09684064d8f3f35313f8d13c5","checkpoint_kind":"candidate","checkpoint_tree_oid":"7393c5731d895328d17ce478214454f64c28ff40","created_at":"2026-10-07T23:30:00+00:00","gate_receipt_digest":"c961be358b8dc55793a6c74f36cc05b7112d829cd8b59924f7616ca0648e0050","manifest_digest":"07d60706d4202a09f14b42500c2da3936d33d4d265bb2f014d50e5387cfc8c2e","parent_checkpoint_commit_oid":"a8e074d765d94a7e816b7ab49db428fd4a760a9f","paths":[{"action":"include","attribution":"task_owned","content_digest":"1d1e9cb166e6d3f4668d7733893d71d0e14244edba63efc3cc82376429a18712","path":"sample.py"}],"plan_version":"sc0-controlled-v1","ref":"refs/work-engine/checkpoints/sc0-oracle/slice-1/candidate-1","run_id":"sc0-oracle","schema_version":1,"scope_revision":"sc0-scope-v1","slice_number":1,"task_patch_digest":"b61af5824c4121108216aeb4f9daa359b5b313f754836057a321415fc239e7d0"},"construction_method":"slice_checkpoint_candidate_receipt","evidence_cutoff":"2026-10-07T23:30:00+00:00","limitations":[],"repository":"/home/bline/code/.work-engine-tmp/sc0/oracle-repo","schema_version":2},"subject_digest":"5f189816aedcc2dc65b2953518241f6a054e25612fe3905340352ebf7e8efd23"}
