{"analyzer":{"checkpoint_validator_sha256":"1b814da3ef9e1f20804b934b91f6621ed65159dd9dfab5bfbfdd2df95f82d20b","name":"work-engine-deterministic-baseline","source_sha256":"47e486ce1539bbfe1ab466d77650d9bb3e0338222478ae445fe6a07ba95e2003","version":"2"},"coverage":{"manifest_paths":6,"path_scope":"attributed checkpoint manifest","profiled_paths":6},"limitations":["Renames are intentionally disabled in the deterministic baseline.","Changed-symbol analysis is bounded to top-level Python definitions."],"observations":{"changed_symbols":{"state":"observed","value":[{"measurement":{"reason":"version 2 symbol analysis supports Python only","state":"unsupported"},"path":"asset.bin"},{"measurement":{"reason":"python_parse:7d5eddea31170e5824d19765cad7411affef028572ab7a9bf62eea9fa086c75d","state":"failed"},"path":"broken.py"},{"measurement":{"reason":"version 2 symbol analysis supports Python only","state":"unsupported"},"path":"config/settings.toml"},{"measurement":{"reason":"version 2 symbol analysis supports Python only","state":"unsupported"},"path":"docs/guide.md"},{"measurement":{"state":"observed","value":[{"change":"added","name":"added"},{"change":"modified","name":"old"}]},"path":"sample.py"},{"measurement":{"state":"observed","value":[{"change":"added","name":"test_new"}]},"path":"tests/test_case.py"}]},"configuration_file_count":{"state":"observed","value":1},"documentation_file_count":{"state":"observed","value":1},"file_categories":{"state":"observed","value":{"configuration":1,"documentation":1,"other":1,"source":2,"test":1}},"file_count":{"state":"observed","value":6},"files":{"state":"observed","value":[{"additions":null,"binary":true,"category":"other","deletions":null,"path":"asset.bin"},{"additions":2,"binary":false,"category":"source","deletions":0,"path":"broken.py"},{"additions":2,"binary":false,"category":"configuration","deletions":0,"path":"config/settings.toml"},{"additions":1,"binary":false,"category":"documentation","deletions":0,"path":"docs/guide.md"},{"additions":4,"binary":false,"category":"source","deletions":1,"path":"sample.py"},{"additions":2,"binary":false,"category":"test","deletions":0,"path":"tests/test_case.py"}]},"hunk_count":{"state":"observed","value":5},"line_totals":{"reason":"binary diff has no textual line totals","state":"unsupported"},"module_distribution":{"state":"observed","value":{".":3,"config":1,"docs":1,"tests":1}},"test_file_count":{"state":"observed","value":1}},"profile_digest":"1ed31d8409fb5abe4570ae63fdb2f00789a80e768db477fe28ac88588c319063","provenance":{"derivation_sources":{"checkpoint_subject":{"identity":{"subject_digest":"e3d90f49fa5e9cdbc687ed0bbe0b759c1cde8da58141b163ec582264c8e9adba"},"use_state":"used"},"checkpoint_validator":{"identity":{"sha256":"1b814da3ef9e1f20804b934b91f6621ed65159dd9dfab5bfbfdd2df95f82d20b"},"use_state":"used"},"classifier":{"reason":"deferred_by_profile_scope","use_state":"not_used"},"git_runtime":{"identity":{"executable_sha256":"5516c9f362c29376ab9a499a33082f9f611941d8c75930c880e30ad109e39c9a","version":"git version 2.53.0"},"use_state":"used"},"invariant_catalog":{"reason":"deferred_by_profile_scope","use_state":"not_used"},"python_runtime":{"identity":{"executable_sha256":"52e0a13e60a981d8c4b6478be2ba5176f69da07948a056bf49cf6f077e30cb41","implementation":"CPython","version":"0.0.0"},"use_state":"used"},"repository_trees":{"identity":{"baseline_tree_oid":"17868afbf46ea53715981fce83171001c632b957","result_tree_oid":"882023b5f0d6b89425f151aab85e6534a53cf5bb","task_patch_digest":"3fc3693325147d6f2c839116f9b2b793b7ce5e4d3182aa4c747f2d55ae6c099e"},"use_state":"used"},"structural_graph":{"reason":"deferred_by_profile_scope","use_state":"not_used"}},"producer":{"checkpoint_validator_sha256":"1b814da3ef9e1f20804b934b91f6621ed65159dd9dfab5bfbfdd2df95f82d20b","name":"work-engine-deterministic-baseline","source_sha256":"47e486ce1539bbfe1ab466d77650d9bb3e0338222478ae445fe6a07ba95e2003","version":"2"}},"schema_version":2,"subject":{"checkpoint":{"baseline_commit_oid":"a8e074d765d94a7e816b7ab49db428fd4a760a9f","baseline_tree_oid":"17868afbf46ea53715981fce83171001c632b957","candidate_attempt":1,"checkpoint_commit_oid":"49624730af1663f50a3ff85abfdd1b90647d0cdb","checkpoint_id":"07237cbc23eddd7a39aad94ee56dc71a44fe2064a87872469d23008c0a266d94","checkpoint_kind":"candidate","checkpoint_tree_oid":"882023b5f0d6b89425f151aab85e6534a53cf5bb","created_at":"2026-10-07T23:40:00+00:00","gate_receipt_digest":"c927b51b887e37f6fdc02e1fabfadddd211d0ac30712cbc6c5028993ad3889c2","manifest_digest":"5664cc29b7c08107cbaf3630b254f3efd467d22cf4294d6efb9ad8b48a36898d","parent_checkpoint_commit_oid":"a8e074d765d94a7e816b7ab49db428fd4a760a9f","paths":[{"action":"include","attribution":"task_owned","content_digest":"0851566aff6b7c82ba69aa44e56a5ed5960d5c960abc5dfc307a1a80adbf48c6","path":"asset.bin"},{"action":"include","attribution":"task_owned","content_digest":"6b8c8a725c23dc076d9a2c185ce4e02435746bc3b4f99906d13de360e56898c7","path":"broken.py"},{"action":"include","attribution":"task_owned","content_digest":"ed52019a4a887ba50303163221c3192cf3876d213737da502c41c3118f1ab5f0","path":"config/settings.toml"},{"action":"include","attribution":"task_owned","content_digest":"d0c160d81e77dca7116286e8f0cb5cc5c1cc6c399b8eb7c88d069dd8a545da6c","path":"docs/guide.md"},{"action":"include","attribution":"task_owned","content_digest":"1d1e9cb166e6d3f4668d7733893d71d0e14244edba63efc3cc82376429a18712","path":"sample.py"},{"action":"include","attribution":"task_owned","content_digest":"cda8b00f47f3aeec88a102c42e0417cbb1aaac7dbd056424ed6f8876dfa2830a","path":"tests/test_case.py"}],"plan_version":"sc0-controlled-v1","ref":"refs/work-engine/checkpoints/sc0-oracle-c2/slice-1/candidate-1","run_id":"sc0-oracle-c2","schema_version":1,"scope_revision":"sc0-scope-v1","slice_number":1,"task_patch_digest":"3fc3693325147d6f2c839116f9b2b793b7ce5e4d3182aa4c747f2d55ae6c099e"},"construction_method":"slice_checkpoint_candidate_receipt","evidence_cutoff":"2026-10-07T23:40:00+00:00","limitations":[],"repository":"/home/bline/code/.work-engine-tmp/sc0/candidate-2/oracle-repo","schema_version":2},"subject_digest":"e3d90f49fa5e9cdbc687ed0bbe0b759c1cde8da58141b163ec582264c8e9adba"}
